StatId	DisplayName_en	Description_en	DisplayName_ru	Description_ru	IconName
MAG_BG_BlightBringer_Shortbow	Blightbringer	Conducting a series of increasingly sick rituals - involving the ashes of a gnome and silkworms fed fat on the corpse of a dwarven cleric - the goblin shaman Kirruk Redrats created this deadly bow. 	Несущий погибель	Проводя серию все более и более нездоровых ритуалов (с использованием праха гнома и шелкопрядов, вскормленных на трупе дварфийского священника), шаман гоблинов Киррук Редратс создал этот смертоносный лук. 	
MAG_BG_Darkfire_Shortbow	Darkfire Shortbow	This length of yew was polished in a lacquer made from the mingled, cooled, and refined breath of a gold and silver dragon. 	Короткий лук темного пламени	Этот тисовый лук был отполирован лаком, сваренным из смешанного, охлажденного и очищенного дыхания золотого и серебряного дракона. 	
MAG_BG_DragonsBreath_Glaive	Drakethroat Glaive	Kereska, the draconic goddess of arcane knowledge, gifted this glaive to a dragonborn when facing off against a group of carbuncular spiders. How their arachnid legs curled and blackened before that night's dark business was done! 	Глефа драконьей глотки	Кереска, драконья богиня мистического знания, даровала эту глефу драконорожденному во время сражения с карбункулярными пауками. О, как скручивались и чернели лапы арахнидов в ту темную ночь! 	
MAG_BG_Gargoyle_Boots	Gargoyle Boots	These boots are heavy and slow to step in - perhaps due to the gargoyle spirit reportedly trapped within. While that legend's truth is debatable, the protection these boots offer against toe-stubbing is not.	Сапоги гаргульи	Сапоги эти тяжелы, и поступь в них нетороплива – по легенде, из-за того, что в них заточен дух гаргульи. О правдивости этой легенды можно спорить до посинения, но вот защиту пальцев ног сапоги обеспечивают отменную.	Generated_MAG_BG_Gargoyle_Boots_Magic
MAG_BG_Harmonium_Halberd	Harmonium Halberd	The platinum inlays of this halberd hum an otherworldly harmony in the key of C, heightening the wielder's vigour but diminishing their mental faculties. The sound it makes is pining, as if far from its rightful home.	Алебарда гармонии	Платиновые вставки в этой алебарде гудят, исполняя потустороннюю мелодию в до миноре – повышая бодрость владельца, но отвлекая разум. Звук, который она издает, звучит почти как стон, словно она тоскует по далекому дому. 	
MAG_BG_Harold_HeavyCrossbow	Harold	Named after Harold Butterbisk, who owned the Butterbisk Inn in Waterdeep before it was renamed by new owners. The stock of the crossbow reads: Quaffing is a shootable offence. 	Гарольд	Назван в честь Гарольда Печеньки, владельца таверны в Глубоководье, которая также поначалу называлась «Печенька», но затем была переименована новыми владельцами. На ложе арбалета вырезано предупреждение: «Не бузи, не то упокоен будешь». 	
MAG_BG_Nimblefinger_Gloves	Nimblefinger Gloves	For the right wearer, these supple doeskin gloves offer both comfort and protection - alongside a perfectly attuned sense of where one's fingers are, and what pocket they're picking. 	Перчатки ловких пальцев	Правильному владельцу эти перчатки из мягкой оленьей кожи обеспечивают комфорт и защиту, а также четкое ощущение того, где находятся пальцы и в чей карман они лезут. 	
MAG_BG_OfAges_Flail	Flail of Ages	Created by a warmongering rakshasa and kept for a time under the careful watch of an astute noble named Lord de'Arnise, this flail is a tool of absolute destruction, and a versatile one at that.	Цеп эпох	Этот цеп, созданный воинственным ракшасом и долгое время хранившийся под пристальным наблюдением проницательного лорда де'Арниса, – универсальный инструмент абсолютного разрушения.	
MAG_BG_OfCrushing_Gloves	Gloves of Crushing	Stitched into the fabric of these gloves are the words: Largest and Largesse, For The Discerning Murderer. 	Перчатки подавления	На ткани этих перчаток вышита надпись: «Величие и размах, для стильного убийцы». 	
MAG_BG_OfDevotion_Shield	Shield of Devotion	Any tales about the Paladins of Velen are so ancient as to be almost certainly hearsay. Irrefutable, however, is the powerful blessing they left on this ancient shield, which inspires heart-fluttering bravery to this day.	Щит преданности	Любые сказания о паладинах Велена настолько древние, что почти наверняка являются вымыслом. Неопровержимым, впрочем, является мощнейшее из благословений, что оставлено на этом древнем щите, который и по сей день вдохновляет сердца на подвиги.	
MAG_BG_OfDexterity_Gloves	Gloves of Dexterity	The point at which the gloves meet the wrist is form-fitting and very snug; almost a hint at the supple quickness and skill these gloves permit the wearer. 	Перчатки ловкости	То место, где эти перчатки закрывают запястье, отличается особой мягкостью и удобством. Это намек на ту гибкость и быстроту, которые обретает их владелец. 	
MAG_BG_OfEasthaven_Defender_Flail	Defender Flail	This flail was created to commemorate victory over the devil Belhifet. It has since made its way so far from Easthaven that the locals have long forgotten that chapter of their town's past.	Цеп защитника	Изначально этот цеп был выкован в честь победы над дьяволом Белхифетом, но с тех пор проделал далекий путь и сменил множество владельцев. Истхейвен давно забыл о раздвоенных хвостах своего прошлого.	
MAG_BG_OfSpeed_LightCrossbow	Light Crossbow of Speed	Bolts slot into this crossbow with wonderful ease, as if eager to nestle against the stock, soon to fly. 	Легкий арбалет скорости	Болты заряжаются в этот арбалет с изумительной легкостью, словно им не терпится оказаться на ложе, а потом отправиться в полет. 	
MAG_BG_OfTheBanshee_Bow	Bow of the Banshee	The impression of an elven face screams silently from the finely curved bow - the image becomes even more disturbing when the bowstring snaps forward on release, emitting a blood-curdling wail.	Лук баньши	Изображение эльфийского лица беззвучно кричит с этого изящно изогнутого лука. Образ становится еще тревожнее, когда спущенная тетива срывается вперед, издавая леденящий кровь вой.	
MAG_BG_OfTheMasters_Legacy_Gauntlet	Legacy of the Masters	Formerly the property of the royalty of Threskel, these gauntlets impart some of the prince of Threskel's legendary skill with weapons.	Наследие мастеров	Эти перчатки некогда принадлежали правящему дому Трескела и отчасти сохранили легендарную сноровку трескельского принца в обращении с оружием. 	
MAG_BG_Sarevok_OfChaos_Greatsword	Sword of Chaos	The sword of Sarevok, brother of Gorion's Ward and child of the evil god Bhaal. Though much of its power died with him, the sword is still formidable, and glows with a malevolent light.	Меч хаоса	Меч Саревока, брата воспитанника Гориона и отпрыска злобного бога Баала. Хотя почти вся его сила умерла вместе с ним, этот меч по-прежнему выглядит грозно и мерцает недобрым светом. 	
MAG_BG_Wondrous_Gloves	Wondrous Gloves	A series of motivational quotes have been enthusiastically removed from the embroidery of these gloves, as if in protest. 	Восхитительные перчатки	Когда-то эти перчатки были щедро расшиты мотивационными призывами, но их все убрали, словно в знак протеста. 	
MAG_Banites_Gloves	Servitor of the Black Hand Gloves	Covetous of Mystra's command of the Weave, Bane the Black Hand extends his grasp, each finger comprised of ten thousand fanatics, adjuncts of his evil will.	Перчатки служителя Черной Руки	Из зависти к тому, как умело Мистра управляется с Плетением, Бейн Черная Рука решил усилить свою хватку: каждый палец состоит из десятков тысяч фанатиков, творящих его злую волю.	Generated_MAG_Banites_Gloves_Magic
MAG_BarbMonk_Cloth_Hat_A_1_Late	Fistbreaker Helm	'If your foe rains down blows upon your head, turn not the other cheek, but let your pricking helm bleed the bastards dry.'	Шлем крушителя кулаков	«Если супротивник ударил тебя по левой щеке, подставляй не правую, а острую кромку шлема, и пусть ублюдок истечет кровью», – этот шлем, равно как и сопутствующая ему поговорка, использовались монахами Пути безмолвной ярости.	
MAG_BarbMonk_Defensive_Cloth	The Graceful Cloth	A garment worn by one of three monks who fought together against &lt;i&gt;Headless Serpent, Secret Venom&lt;/i&gt;, a gang in the port city of Nyanzaru. This was worn by Roahton Mobar, whose stances were broad and strong.	Одеяние благородства	Одеяние одного из трех монахов, сражавшихся с шайкой &lt;i&gt;Безголовый змей, Тайный яд&lt;/i&gt; из портового города Найанзару. Имя владельца было Роатон Мобар, его движения были мощными и размашистыми.	
MAG_BarbMonk_Leather_Circlet	Scabby Pugilist Circlet	Every adventuring party has at least one 'chaotic element'. In the case of one such party, this was the infamous Scabby, a barbarous goblin who was trained by monks.	Обруч драчуна Паршивца	В каждом отряде искателей приключений есть хотя бы один «хаотический элемент». В одном отряде таким элементом был печально известный Паршивец, гоблин-варвар, которого обучали монахи. Паршивец был не дурак пропустить кружку пива – вернее сказать, кружек семь или тридцать. Ну а потом он затевал драки – иногда с целыми компаниями, и иногда и с близлежащей мебелью.	Generated_MAG_BarbMonk_Leather_Circlet_Magic
MAG_BarbMonk_Offensive_Cloth	The Mighty Cloth	A garment worn by one of three monks who fought together against &lt;i&gt;Headless Serpent, Secret Venom&lt;/i&gt;, a gang in the port city of Nyanzaru. This was worn by Kimigha Poji, whose stances were narrow and swift.	Одеяние могущества	Одеяние одного из трех монахов, сражавшихся с шайкой &lt;i&gt;Безголовый змей, Тайный яд&lt;/i&gt; из портового города Найанзару. Имя владельца было Кимига Поджи, он двигался стремительно и точно.	
MAG_Barbarian_BoneSpike_Armor	Bonespike Garb	Sharp juts and knobbly nodules of bone stud this armour, as if something ancient sank its teeth deep into the leather and they got stuck there.	Наряд костяных шипов	Острые выступы и шишковатые костяные наросты усеивают доспех, словно зубы какого-то древнего существа глубоко впились в легкую кожу, да так и застряли.	
MAG_Barbarian_BoneSpike_Gloves	Bonespike Gloves	These gloves were soaked in the marrow of a Dragon Turtle, its bones broken and their fluid drained in sloppy chunks into vats.	Перчатки костяных шипов	Эти перчатки пропитаны костным мозгом драконовой черепахи. Ей переломали кости, и густая жижа с хлюпаньем стекала в чаны.	Item_ARM_Gloves_Barbarian_Magic_B
MAG_Barbarian_BoneSpike_Helmet	Bonespike Helmet	The tibia of a storm giant was ground and chiselled and reworked till it became this helm. The wearer can actually smell summer tempest clouds like maroon-dark dread while wearing the helm.	Шлем костяных шипов	Голень штормового великана отшлифовали, выточили и обработали, превратив вот в этот шлем. Надев его, владелец может почувствовать запах летних грозовых туч, навевающий темно-бордовый ужас.	Item_ARM_Helmet_Barbarian_Magic_B
MAG_Barbarian_BoneSpike_Shoes	Bonespike Boots	Armour designed for the aerodynamic leaping and striking and general screaming of your standard barbarian. 	Сапоги костяных шипов	Доспех, разработанный для аэродинамических прыжков, ударов и громких воплей варвара обыкновенного. 	Item_ARM_Shoes_Barbarian_Magic_B
MAG_Barbarian_Magic_Armor_1	Enraging Heart Garb	Created by a designer and an enchanter who were going through a messy divorce at the time. As such the armour is filled with passive-aggressive rage.	Одеяние ярости сердца	Создавшая эти доспехи мастерица и заклинательница переживала в то время тяжелый развод – так что наполнены они пассивно-агрессивной яростью. И, как ни странно, ощущением, что последние десять лет жизни ты потратила на полного кретина. Что способствует общему недовольству. 	Item_ARM_Barbarian_Magic
MAG_Bard_HealingBardicInspiration_Hat	Cap of Curing	Putting on this hat is somehow enough to lift your spirits.	Духоподъемная шапка	Почему-то как наденешь эту шапку – сразу на душе легче становится.	Item_MAG_Bard_HealingBardicInspiration_Hat
MAG_Bard_RefreshBardicInspirationSlot_Shoes	Boots of Brilliance	Tiny bells are sewn into the boots' cuffs. They jingle subtly with every step.	Сапоги великолепия	Отвороты сапог обшиты крошечными бубенчиками. При каждом шаге они издают нежный звон.	Item_MAG_Bard_RefreshBardicInspirationSlot_Shoes
MAG_Bard_TempHP_Armor	Blazer of Benevolence	Even though the embroidered velvet won't help against a sharp blade, wearing it fills you with self-assuredness.	Куртка великодушия	Расшитая атласная куртка не спасет от острого клинка, зато ее носителя переполняет уверенность в себе.	Item_MAG_Bard_TempHP_Armor
MAG_BasicEnchanted_Quarterstaff	Melf's First Staff	In spite of (or perhaps because of) his suspiciously amusing name, the wizard Melf was actually quite a talented spellcaster and innovator in the field of the arcane. He even led an order called the Knights of Luna.	Первый посох Мелфа	Невзирая на свое потешное имя (а возможно, именно благодаря ему) волшебник Мелф был необычайно талантливым заклинателем и магическим изобретателем. Он даже возглавлял орден, именуемый «Рыцари Луны».&lt;br&gt;&lt;br&gt;Но до чего же с именем все-таки не повезло бедолаге.. 	
MAG_Bhaalist_Armor	Bhaalist Armour	Bhaal, Lord of Murder, was forced to walk the world as a mortal man during a period of history called the Time of Troubles. He was more vulnerable than he had ever been.&lt;br&gt;&lt;br&gt;But Bhaal was cunning. He had contingencies in case he died. 	Доспех служителя Баала	Баал, Владыка Убийств, был вынужден скитаться по миру как простой смертный в период истории, называемый Смутным временем. Он был более уязвим, чем когда-либо.&lt;br&gt;&lt;br&gt;Но Баал был хитер. И подготовился к собственной смерти. 	Generated_MAG_Bhaalist_Armor_Magic
MAG_Bhaalist_Gloves	Bhaalist Gloves	When the Lord of Murder, Bhaal, was rendered mortal, he knew his days were numbered. His vile machinations had gained him many enemies.&lt;br&gt;&lt;br&gt;Those days ran out and Bhaal was indeed killed, not by a god, but by a man with hawkish features named Cyric. 	Перчатки слуги Баала	Когда Владыка Убийств Баал стал смертным, он осознал, что его дни сочтены. Гнусные махинации нажили ему множество врагов.&lt;br&gt;&lt;br&gt;И Баал действительно был убит – но не божеством, а человеком с ястребиными чертами лица по имени Цирик. 	
MAG_Bhaalist_Hat	Assassin of Bhaal Cowl	When he was killed, Bhaal's blight upon the world was not destroyed. For the many people upon whom he had sired his spawn slithered out of tainted wombs, and with their arrival Bhaal's malcontent returned with force. 	Капюшон ассасина Баала	Даже после того, как Баала убили, его отрава никуда из мира не делась. Порожденные им отродья выбрались из оскверненных утроб, и с их появлением зловещий Баал вновь набрал силу. 	Generated_MAG_Bhaalist_Hat_Magic
MAG_Bhaalist_Paralyzing_Dagger	Stillmaker	The dagger's twisting blade is designed to nick the flesh as many times as possible, allowing its paralytic poison to flow effortlessly into any unfortunate target.	Обездвиживатель	Кривое лезвие кинжала предназначено для того, чтобы прорезать как можно больше плоти. Так в кровь несчастной цели попадет больше всего паралитического яда, которым смазан клинок.	
MAG_BlackTentacle_Amulet	Strange Tendril Amulet	Eldritch sigils seem to coarse through the metalwork on this amulet.	Амулет странных завитков	Потусторонние знаки словно проступают изнутри через металл этого амулета.	
MAG_Blindside_Shortsword	Render of Mind and Body	The best offence is a struck cognisance.	Рассекатель разума и тела	Лучшее нападение – это внезапное осознание.	
MAG_Bloodsoaked_Greataxe	Bloodsoaked Greataxe	Droplets of blood bead the edge of this axe like rain on glass, yet they never drip, and touching them reveals them to be smooth, hard gemstones. 	Омытый кровью двуручный топор	Капли крови усеивают лезвие этого топора, подобно дождевым каплям на стекле, но не стекают с него. Если к ним прикоснуться, становится ясно, что это гладкие, твердые самоцветы. 	
MAG_Bonded_Baneful_Shortsword	The Baneful	The wizard Otiluke wrote about bound weapons and their propensity to coalesce with their wielder as the pair come together. He also wrote about their dangers, which are manifold, and their benefits, which make the danger worth it. 	Пагубный	Волшебник Отилюк писал о связанном оружии и о его склонности как бы сливаться со своим хозяином, когда они соединяются вместе. Писал он и о многочисленных опасностях, исходящих от него, и о пользе, которая делает опасности оправданными. 	
MAG_Bonded_Lethal_Longsword	Blood-Bound Blade	This weapon was wielded by the lionlike eldritch knight Cypress of the Starfeller clan, who took on challenges of the heart and mind with palpable brilliance, and fought with a skill and heated intensity that was almost solar. 	Связанный кровью клинок	Этим оружием некогда владел потусторонний рыцарь львиного образа Кипарис из клана Звездоходцев. Испытания сердца и разума он проходил с захватывающим дух великолепием, а сражался с пылкостью и яростью самого солнца. 	
MAG_Bonded_Shield	Shield of Returning	When asked how he felt about weapons that return to you when thrown, famous adventurer Lupperdiddle Swires responded, 'Not for me. They remind me too much of someone I used to know.'	Щит возвращения	Когда знаменитого искателя приключений Луппердиддла Свайрса спросили, как он относится к оружию, которое после броска возвращается к владельцу, он ответил так: «Не мое это, приятель. Липучие они, как любовницы, которых никак не пошлешь». 	
MAG_Bonded_Shocking_Warhammer	Charge-Bound Warhammer	Energy crackles in weird and wonderful patterns across your hand as you wield this bound weapon, as if your very veins were marbled like a cloud of blue-white lightning. 	Связанный с зарядом молот	Когда вы держите это связанное оружие, странные и удивительные узоры энергии с треском расходятся по руке – словно ваши вены сотворены из мрамора в облаке синевато-белых молний. 	
MAG_Bonded_Throwing_Battleaxe	Rebound Battleaxe	This axe is so loyal, it will sometimes return to wielders it favours.	Отскакивающий боевой топор	Этот топор настолько верен своему владельцу, что иногда к нему возвращается.	
MAG_BonusAttack_AgainstMarked_Circlet	Circlet of Hunting	Huntresses prowling in the least hospitable woods of Toril hold one rule as cardinal: kill quickly. This is not about suffering. It's about sound, and its necessary absence. 	Охотничий обруч	Охотницы в самых негостеприимных лесах Торила придерживаются одного основного правила: убивать быстро. Но не из жалости, нет. Просто жертва не должна успеть издать ни звука. 	Item_ARM_CircletOfBlasting
