StatId	DisplayName_en	Description_en	DisplayName_ru	Description_ru	IconName
MAG_Healer_HealSelf_Helmet	Wapira's Crown	Legends say a giant elk and a druid once formed a powerful friendship. When the elk laid down his life for the druid, she crafted this helmet in honour of her beloved friend, so his beauty and compassion would live on forever.	Венец Вапиры	В легендах рассказывается о друидессе, некогда водившей дружбу с гигантским лосем. Когда тот пожертвовал собой, защищая ее, она создала особый шлем, призванный напоминать ей о красоте и добром сердце ее дорогого друга.	Item_ARM_Helmet_Leather_Druid
MAG_Healer_TempHPOnHeal_Boots	Boots of Aid and Comfort	Sturdy and well-worn, these boots make a snug fit on any wearer.	Ботинки поддержки и подмоги	Хорошо разношенные крепкие ботинки, отлично сидящие на любой ноге.	Generated_MAG_Healer_TempHPOnHeal_Boots_Magic
MAG_Heat_Fire_Robe	Obsidian Laced Robe 	The inside of this robe is dark and faceted like volcanic glass, yet the material is light and soft. Against the skin, it also produces a heat like a toasty fire on a day of snow. 	Одеяние с обсидиановой отделкой 	Подкладка этого одеяния – темная и фасетчатая, подобно вулканическому стеклу, но на ощупь ткань кажется мягкой и легкой. Она согревает кожу, как жаркий костер в морозный день. 	Generated_MAG_Heat_Fire_Robe_Magic
MAG_Helmet_Human_Watcher	Steel Watcher Helmet	'When I found Carixim, he turned to me, with all those poor people's souls crammed into him, and he... he grinned at me. He said, "I been expecting you, boy."' - Overheard from the smith Dammon	Шлем стального стража	«Когда я нашел Кариксима, он повернулся ко мне... все эти несчастные души, втиснутые в него, словно слишком много пчел в прогнивший улей... и он... он ухмыльнулся мне. И сказал: „Я ждал тебя, мальчик"». – Подслушано у кузнеца Даммона. 	Generated_MAG_Helmet_Watcher_A_Magic
MAG_HigherNecromancy_Staff	Hollow's Staff	This staff was wielded by Thibault Hollow, a supremely talented necromancer notable for his overwhelming fear of zombies. Many was the time when his dread lair would echo with a high-pitched shriek when one of them surprised him in a corridor, or when he was taking a bath. 	Посох Холлоу	Этот посох принадлежал Тибальту Холлоу, невероятно талантливому некроманту, отличавшемуся непреодолимым страхом перед зомби.&lt;br&gt;&lt;br&gt;Его логово не раз содрогалось от пронзительных воплей, когда зобми случайно сталкивались с Тибальтом в коридоре или заглядывали в ванную, когда он купался. 	
MAG_Hunting_Shortbow	Hunting Shortbow	Supple and strong, this shortbow has been imbued with a ranger's solemn magic - running your fingers along the smooth ash, you can feel that solemnity like a ghost in the shaped wood. 	Охотничий короткий лук	Этот гибкий и прочный лук был пропитан строгой и торжественной магией следопыта. Ведя пальцами по гладкому ясеню, вы чувствуете эту торжественность, словно чью-то душу, заключенную в древесину лука. 	
MAG_Illithid_Carapace_Armor	Cerebral Citadel Armour 	The little tentacle engravings are a nice touch. 	Доспех церебральной цитадели 	Крохотные выгравированные щупальца – это так мило. 	Generated_MAG_Illithid_Carapace_Armor_Magic
MAG_Illithid_Carapace_Gloves	Cerebral Citadel Gloves	The taut violet leather is drier than snakeskin, and puckered at each knuckle with shallow mouth-shaped pits. 	Перчатки церебральной цитадели	Туго натянутая фиолетовая кожа на ощупь суше, чем змеиная, и на каждой костяшке – неглубокая впадинка в форме жадно раскрытого рта. 	
MAG_Illithid_CharmPerson_Ring	Ring of Beguiling 	Whispers in the Deep Speech of the Underdark insinuate themselves into the mind of whoever so much as brushes against the burnished metal of this ring. 	Кольцо завлечения 	Шепотки на глубинном наречии Подземья проникают в сознание любого, кто даже случайно коснется полированного металла этого кольца. 	
MAG_Illithid_MindOverload_Weapon_Longsword	Blade of Oppressed Souls	Fragments of dead souls are imprisoned in the steel. Angry, powerful, hopeful, or scared - all of them rose up against their illithid masters, and all of them fell to this blade. Now, they are trapped forever, forced to aid their oppressors.	Клинок угнетенных душ	Фрагменты мертвых душ, плененные сталью. Озлобленные, могущественные, исполненные надежды или напуганные – все они восстали против своих хозяев-иллитидов и были убиты этим клинком. Теперь они навеки обречены пребывать здесь и помогать своим угнетателям.	
MAG_Illithid_MindTax_Amulet	Synaptic Needle Amulet 	Fingering this amulet sends a spike of pleasure sliding through the brain - pleasure that could be turned to pain in an enemy's addled mind. 	Амулет синаптической иглы 	Когда ты вертишь этот амулет в пальцах, волна наслаждения нарастает в мозгу... но она может хлынуть болью в помутившийся разум противника. 	
MAG_Illithid_Regen_Circlet	Circlet of Mental Anguish	Fell magic has seeped into this circlet, rejoicing at the slightest touch of despair.	Обруч душевных терзаний	Этот обруч пронизан недоброй магией и с наслаждением реагирует на малейшие нотки отчаяния.	
MAG_Infernal_Hellbeard_Halberd	Hellbeard Halberd	Salvaged from the beard of a dead infernal leviathan, whose facial hair was formed from the weapons of an army it had once vanquished.	Алебарда адской бороды	Собрана из бороды мертвого адского левиафана. Поросль у него на морде состояла из оружия разгромленного войска. При жизни левиафана это смотрелось, как густая борода с шевелящимися стальными волосками. 	
MAG_Infernal_Longsword	Infernal Longsword	Precise infernal runes are woven into this weapon's filigree, implying a creator well-versed in hellish arcana.	Адский длинный меч	В чеканку этого оружия вплетены дьявольские руны, что выдает плотное знакомство создателя оружия с адской магией.	
MAG_Infernal_Mace	Infernal Mace	Precise infernal runes are woven into this weapon's filigree, implying a creator well-versed in hellish arcana.	Дьявольская булава	В чеканку этого оружия вплетены дьявольские руны, что выдает плотное знакомство создателя оружия с адской магией.	
MAG_Infernal_Metal_Boots	Helldusk Boots	No ore takes better to being forged than the infernal iron of Avernus, where the archdevil Zariel presides.	Сапоги адского заката	Никакое адское железо не куется так легко и охотно, как руда и слитки из Аверно. Там архидьяволица Зариэль правит безжалостной пустошью, сам воздух которой мерцает от жара озер магмы. 	Generated_MAG_Infernal_Metal_Boots_Magic
MAG_Infernal_Metal_Gloves	Helldusk Gloves	What precisely confers eternal punishment, reward, absolution? Perhaps it's not just belief in a god. Perhaps the deciding factor is whether the gods believe in you.	Перчатки адского заката	Откуда в точности берется вечное наказание, вознаграждение, отпущение грехов? Возможно, не только из наличия веры в богов (чьи проявления в материальном мире сомнительны) или ее отсутствия в твоей душе. Возможно, решающим фактором является то, верят ли соответствующие боги и дьяволы в тебя.	Item_ARM_Gloves_Demon_A
MAG_Infernal_Metal_Helmet	Helldusk Helmet	It is said that Carixim, the fiendish titan whose flesh squirms with twenty-thousand trapped souls, forged the pieces of this armour set. 	Шлем адского заката	Говорят, что Кариксим, омерзительный титан, чья плоть кишит двадцатью тысячами пойманных душ, выковал этот комплект доспехов. 	
MAG_Infernal_Plate_Armor	Helldusk Armour	Carixim, soul-stuffed forgemaster of hellish Avernus, hammers away ceaselessly at new creations. Questions of morality and destiny do not concern him. Conscience is for his betters. He works with cheer, his swollen skin moaning soothingly. 	Доспехи адского заката	Кариксим, адский кузнец, по горло набитый чужими душами, без устали бьет молотом под непрестанные вопли проклятых. Вопросы морали и судьбы его не интересуют. Совестью пусть мучаются те, кому больше нечем заняться. Он трудится с наслаждением, его распухшая кожа успокаивающе постанывает. 	Item_MAG_Infernal_Plate_Armor
MAG_Infernal_Spear	Infernal Spear	Precise infernal runes are woven into this weapon's filigree, implying a creator well-versed in hellish arcana.	Адское копье	В чеканку этого оружия вплетены дьявольские руны, что выдает плотное знакомство создателя оружия с адской магией.	
MAG_Infernal_Warhammer	Infernal Warhammer	Precise infernal runes are woven into this weapon's filigree, implying a creator well-versed in hellish arcana.	Адский боевой молот	В чеканку этого оружия вплетены дьявольские руны, что выдает плотное знакомство создателя оружия с адской магией.	
MAG_Invisible_Pike	Unseen Menace	Yes, but what exactly is hitting you? 	Незримая угроза	Да, но что на самом деле в тебя попало? 	Item_MAG_Invisible_Pike_GLOW
MAG_Jumping_Shoes	Swiresy Shoes	Likely fashioned in tribute to the extremely small, high-vaulting rascal who pillaged many a hen house - Lupperdiddle Swires.	Башмаки а-ля Свайрс	Скорее всего, изготовлены в память о небольшом, но амбициозном пройдохе, который грабил курятники так же часто, как и логова бехолдеров, – крохотном искателе приключений Луппердиддле Свайрсе. 	
MAG_Justiciar_Scimitar	Justiciar's Scimitar	This light, curved blade is as unusual and unforgiving as the darkness it strikes from. 	Скимитар юстициара	Этот легкий изогнутый клинок так же необычен и неумолим, как и тьма, из которой он бьет. 	
MAG_Justiciar_Shield	Justiciar's Greatshield	It's never the shield that kills you - but hearing your frantic steel thudding uselessly against this reinforced oak in the darkness is a good sign the end is near. 	Большой щит юстициара	Щит вряд ли вас убьет. Но если вы услышите, как ваше оружие бесполезно бьется в темноте об усиленный дубовый каркас щита... знайте, что смерть ваша близка. 	
MAG_Ketheric_Shield	Ketheric's Shield	In the theatre of dreams, Ketheric killed his wife every night. That wasn't how things happened... but always upon waking, he would glare into the dark, long-faced and solemn, and he would think: 'I keep you alive with my memories, beloved. I kill you with what I've become.'	Щит Кетерика	В театре сновидений Кетерик каждую ночь убивал свою жену. На самом деле все было не так... но всегда, просыпаясь, он долго вглядывался в темноту, длиннолицый и торжественный, и думал: «Я сохраняю тебе жизнь воспоминаниями, любимая. Я убиваю тебя тем, кем я стал».	
MAG_Ketheric_Warhammer	Ketheric's Warhammer	This hammer's weight is centred on enchanted obsidian at the base of the head. Some nights before bed, Ketheric would sneak a whey-faced glance at the hammer, and think about the stone, and wonder what unknown facet of his heart bore his weight.	Боевой молот Кетерика	Вес этого молота собран в несущем камне из зачарованного обсидиана у основания головки. Иногда перед сном Кетерик бросает взгляд на молот, думает о камне и все гадает, какая неведомая грань его сердца несет вес его самого.	
MAG_Kuotoa_Lightning_Spear	Lightning Jabber	A makeshift spear fashioned from a giant crab's claw and the charged imagination of kuo-toa fishfolk.	Молниеносный таратор	Имя божества расы куо-тоа звучит как Блипдулпулп. Куо-тоа воспринимают это примерно так же, как большая семья мирится с дядюшкой, который вечно всем рассказывает про свою коллекцию игрушечных поездов. 	Item_WPN_Kuotoa_Javelin_A_1
MAG_LC_BurnOnDamage_Scimitar	Kurwin's Cauteriser 	Mortician Kurwin was known to use his trusty Cauteriser on all sorts of interesting subjects. At first these were cadavers, then people who wouldn't be missed, and it was only after he targeted a well-liked tavern owner that he was ratted out to the law.	Прижигатель Карвина 	Известно, что гробовщик Карвин использовал свой верный Прижигатель на самых интересных объектах. Сперва это были трупы, затем бродяги, которых никто не хватится... и лишь после того, как он нацелился на всеми любимого кабатчика, его сдали властям.&lt;br&gt;&lt;br&gt;И вот тогда жизнь Карвина стала совсем интересной, о да.	
MAG_LC_CazadorVampiric_Quarterstaff	Woe	The gentle tap-tap-tap of a staff on stone sparked terror for all in Cazador's palace. It signalled an approaching storm, and all they could do was shrink into the background and pray its wrath would not fall on them.	Несчастье	Негромкое постукивание посоха по камню вызывало ужас во всем дворце Касадора. Оно было знаком надвигающейся бури, и слугам оставалось только съежиться и затаиться по углам в надежде, что гнев хозяина падет не на них.	Item_MAG_LC_CazadorVampiric_Quarterstaff_GLOW
MAG_LC_ChainDevil_Flail	Planeslayer Flail	Passed from hand to hand by those who hunt creatures from beyond the Material Plane, this flail has two words scrawled on it: 'No Trespassing.'	Цеп планоборца	Этот цеп передавали из рук в руки охотники на чудовищ, обитающих за пределами материального плана. На нем выцарапано всего два слова: «Входа нет».	
MAG_LC_Counterspell_Quarterstaff	Staff of Interruption	This staff hums with a disruptive arcane energy that drives nearby spellcasters to distraction.	Посох прерывания	Прерывающие способности «Контрзаклинания» широко обсуждаются в магических кругах. Большинство молодых волшебников считают, что это невероятно забавно, в то время как их более маститые собратья отмечают, что отмена заклинания – это ровно настолько же смешно, как ампутация в полевых условиях. 	
MAG_LC_Cyric_FearImmunity_Amulet	Dauntless Amulet	Flowing through your chest, threads of whiskey-like warmth - they spread and spread, and who could lay you low, you champion in hopeful hours?	Амулет бесстрашия	Сквозь твою грудь пробиваются тоненькие лучики тепла... их становится все больше, и кто сможет одолеть тебя, ведь ты – последняя надежда угнетенных!	
MAG_LC_DrowSpider_Gloves	Pale Widow Gloves	While many drow revere arachnids, there is undoubtedly a degree of emulation at work in the case of certain loathsome sects - look no further than the spiderlike coldness of the Lolthite community for proof of this mimicry.	Перчатки бледной вдовы	Большинство дроу просто поклоняется паукам, но есть и особо отвратительные секты, которые подражают им по мере возможностей. Один из примеров такой мимикрии – паучья холодность высших служителей Ллос.	
MAG_LC_Fleshred_Longsword	Render of Scrumptious Flesh	It might be your imagination, but when blood runs over the blade, you could swear you hear... slurping. 	Рассекатель аппетитной плоти	Возможно, тебе это только кажется, но когда кровь течет по клинку... нет, правда – этот звук похож на жадное чавканье. 	
MAG_LC_Fleshrend_Shortsword	Fleshrender	The previous owner was going to call this sword Barney, but he got such a bollocking from his friends that he named it Fleshrender instead, and sulked for a whole tenday afterward.	Раздиратель плоти	Прежний владелец поначалу хотел назвать свой меч «Барни», но приятели так глумились над ним, что он переименовал меч в «Раздирателя плоти» и дулся еще целую неделю после этого.	Item_WPN_GTY_Shortsword_A_LowHP_IncreasedDamagePsychic
MAG_LC_Frigid_Trident	Allandra's Whelm	When Allandra was a girl, she saw a hot spall of matter fire through the sky. She wished upon this falling star, but instead of getting an answer from the sky, she got one from the sea in the voice of Umberlee, goddess of the endless fathom.	Прилив Алландры	Когда Алландра была еще девочкой, она увидела, как по небу несется пылающий осколок. Она загадала этой падающей звезде желание, но небо не ответило... зато ответило море – голосом Умберли, богини бездонных глубин.	Item_MAG_LC_Frigid_Trident_GLOW
MAG_LC_HellishMadness_Amulet	Kruznabir's Asylum Amulet	The bauble is emblazoned with fiendish words that, when translated, mean, 'May your throat be educated in new screams.'	Амулет лечебницы Крузнабира	Эта безделушка украшена надписью на дьявольском языке, которая в переводе означает: «Да познает глотка твоя новые вопли».	
MAG_LC_Jannath_Hat	Jannath's Hat	The corner of modern fashion that this hat currently occupies might well be called Optimistic. 	Шляпа Джанната	Уголок современной моды, ныне занятый этой шляпой, можно было бы назвать «Оптимистическим». 	Generated_ARM_Hat_Wizard_B_Magic
MAG_LC_Lorroakan_Quarterstaff	Despair of Athkatla	Touching the adornments, it's clear that Lorroakan's short temper has flowed into his staff. It flows into your brain in shades of burgundy and carmine, bright as the storm-lanterns of Lorroakan's homeland. 	Отчаяние Аткатлы	Стоит прикоснуться к украшениям на этом посохе, и становится ясно, что гневливый нрав Лорроакана передался и его посоху. Отголоски чужого гнева отражаются в твоем сознании всеми оттенками багрянца – они такие же яркие, как штормовые фонари на родине Лорроакана. 	Item_WPN_HUM_Magicstaff_Lorroakan_A
MAG_LC_Lorroakan_Robe	Shelter of Athkatla 	Mantled in the sublime majesty of this cloak, you magically sense Lorroakan's complex feelings for his homeland. Merriment and comfort go hand in hand with a jilted sentiment around his lovers and his family. And the old friends he thought of, but would never see again.	Приют Аткатлы 	Закутавшись в этот великолепный плащ, ты магическим образом воспринимаешь сложные чувства Лорроакана к своей родине – веселье и радость соседствуют с тоской по родным и близким, возлюбленным и старым друзьям, которых он помнил, но никогда больше не увидел.	Generated_MAG_LC_Lorroakan_Robe_Magic
MAG_LC_Nymph_Cloak	Nymph Cloak	The charmers, seducers, philanderers, flirts, gallants, beguilers, ravishers, rogues, tempters, and tantalisers of the Feywild all share one common trait: they make you feel as if you are the only diamond among the drift. 	Плащ нимфы	Покорители сердец, соблазнители, развратники, любители флирта, кавалеры, обманщики, воры, жулики, искусители и зазывалы из мира фей имеют одну черту, которая всех их роднит: они заставляют тебя поверить, что ты – единственный бриллиант в навозной куче. 	Generated_MAG_LC_Nymph_Cloak_Magic
MAG_LC_OfTheFist_MorningStar	Ravengard's Scourger	Duke Ravengard's father was the sort of man who works with his hands, and communicates in grunts. In his heart his son vowed to do better. But when Wyll was born, Ravengard felt a strange gravity that drew him away from his son.	Бич Рейвенгарда	Отец герцога Рейвенгарда был из тех, кто любит и умеет работать руками, зато общается междометиями. Рейвенгард поклялся самому себе, что справится лучше, но когда родился Уилл, герцог ощутил, как что-то не позволяет ему сблизиться с сыном.	
