StatId	DisplayName_en	Description_en	DisplayName_ru	Description_ru	IconName
MAG_TheThorns_Trident	Nyrulna	The forgemaster Lirrico designed this weapon for the champion of the wind goddess Akadi. A key component in the forging was his home city's wind, and for a year after the weapon was made, no wind blew there at all.	Нирулна	Мастер-кузнец Лиррико создал это оружие для воителя богини ветра Акади. Наряду с душами, ключевым компонентом ковки был ветер его родного города, и в течение года после изготовления оружия ветер там вообще не дул.&lt;br&gt;&lt;br&gt;Словно заплутавший порыв, оружие добралось до Чульта. Вероятно, по пути оно сменило немало владельцев, ибо такова его непостоянная судьба.	Item_MAG_TheThorns_Trident
MAG_TheVictory_Longbow	Gontr Mael	Gontr Mael blasted from the corpse of the Steel Watcher Titan: a bow formed from the boiling slag and weird whispering gyros inherent to the mechanical giant. It must have acted as the Titan's abdomen, exchanging muscle for immaculate steel.	Гонтр Маэль	Гонтр Маэль явился из трупа стального стража-титана. Этот лук создан из кипящего шлака и странно жужжащих гироскопов механического великана. Он должен был служить нутром титана, мускулы которого заменила безупречная сталь.	Item_MAG_TheVictory_Longbow
MAG_TheWoundSeeker_Greatsword	Svartlebee's Woundseeker	Wielded by Svartlebee The Custodian, so named because he had the following reputation: Have you got someone in your life causing a mess? Send Svartlebee a missive. He shall clean them up, and then clean up the crime scene. 	Ранитель Свартлеби	Это оружие некогда принадлежало Свартлеби Чистильщику, получившего свое прозвище благодаря весьма специфической репутации: «Кто-то осложняет вам жизнь? Пошлите сообщение Свартлеби. Он сперва уберет проблему, а потом еще и приберет на месте преступления». 	
MAG_Throwable_Pike	Returning Pike	A 'Crazy Wilbur' is a technique invented by the dwarvish Ticklebeard Clan. It involves getting your larger enemies to swallow your weapon, then calling it back to you - as messily as possible.	Возвратная пика	Прием «Чокнутый Уилбур» был изобретен дварфийским кланом Щекотнобородых. Главное – заставить более крупного противника проглотить твое оружие, а потом призвать его обратно максимально кровавым образом. 	
MAG_Thunder_ArcaneAcuityOnThunderDamage_Hat	Hat of Storm Scion's Power	Two sigils glow white where the hat brushes your temples - something is being tapped into; something distant and fearsome.	Шляпа мощи потомка бури	Два символа светятся белым в тех местах, где шляпа касается твоих висков... что-то сюда проникает, что-то далекое и устрашающее. 	Generated_ARM_Hat_Wizard_D_Magic
MAG_Thunder_InflictDazeOnReverberatedCreature_Cloak	Thunderskin Cloak	Through a gap in the long snarls of thread, you are sure you can glimpse a great black thunderhead swollen with purple lightning and spears of rain. 	Плащ громовой шкуры	Сквозь переплетение нитей можно разглядеть громадную черную грозовую тучу, распухшую от пурпурных молний и потоков дождя. 	Generated_MAG_Thunder_InflictDazeOnReverberatedCreature_Cloak_Magic
MAG_Thunder_ReverberationOnRangeSpellDamage_Amulet	Spineshudder Amulet	Quivers creep up your enemy's back - the slow, long-fingered hand of your magic. 	Амулет позвоночной дрожи	Мурашки бегут по спине твоего врага... это неспешная длиннопалая длань твоей магии. 	
MAG_Thunder_ReverberationOnStatusApply_Boots	Boots of Stormy Clamour	Peals of thunder rumble at the back of your skull with every step taken in these boots. 	Сапоги буревых раскатов	Громовые раскаты разносятся у тебя в черепе с каждым шагом, который ты делаешь в этих сапогах. 	Generated_MAG_Thunder_ReverberationOnStatusApply_Boots_Magic
MAG_Thunder_Reverberation_Gloves	Gloves of Belligerent Skies	Balling your fingers into fists while wearing these gloves causes a sonorous chime, like the fusion of a tempest and a church bell, to resound inside your skull. 	Перчатки воинственных небес	Когда ты сжимаешь кулаки в этих перчатках, у тебя в голове раздается звон – как будто разом ударил гром и зазвонили церковные колокола. 	Generated_MAG_Thunder_Reverberation_Gloves_Magic
MAG_Thunder_ThunderClap_Quarterstaff	Cacophony	Carved in circles across the knob of the staff are different words for thunder. Gnomish, Sylvan, Elvish, Celestial, even the Primordial tongue - all of these and more fuse together to form the thunderword.	Какофония 	На набалдашнике посоха вырезаны по кругу различные слова, обозначающие гром. Гномский, лесной, эльфийский, небесный, даже первозданный язык – все они и многие другие сливаются воедино, образуя имя грома. 	
MAG_Toll_Collector_Cloak	Cloak of Avarice	For one to wear this heavy cloak woven of errant, unused gold, one's pockets must hang even heavier still.	Плащ алчности	Чтобы носить этот тяжелый плащ из неиспользованного золота, вам нужно набить карманы еще тяжелее! 	Generated_MAG_Toll_Collector_Cloak_Magic
MAG_Tyrrant_Warhammer	Hammer of the Just	Tyr is often known as the Maimed God - a descriptor he shares with most victims of this heavy warhammer.	Молот праведника	Тир, бог справедливости в Ториле, известен также как Хмурый или Беспристрастный. Это намного добрее, чем его же прозвище Равнорукий – с учетом того, что у Тира только одна рука. 	
MAG_Vampiric_Gloves	Vampiric Gloves	Little leech motifs adorn the pad of each finger. The leeches have rows of suckling, sharp teeth. 	Перчатки вампира	На подушечке каждого из пальцев изображена небольшая пиявка. У пиявок рядами расположены острые впивающиеся зубы. 	
MAG_Vicious_Battleaxe	Vicious Battleaxe		Беспощадный боевой топор		
MAG_Vicious_Dagger	Dolor Amarus	Once wielded by a murderer, the weapon's handle retains an eerie, clammy warmth, as if Dolor's pre-slaughter sweat somehow crept into the leather - and lingers there still. 	Горечь Долора	Этим кинжалом некогда орудовал убийца, и рукоять до сих пор хранит липкое потустороннее тепло – как если бы пот, проступивший на ладонях Долора перед смертельным ударом, каким-то образом впитался в кожу и остался там. 	
MAG_Vicious_Shortbow	Vicious Shortbow		Жестокий короткий лук		
MAG_Vicious_Shortsword	Vicious Shortsword		Жестокий короткий меч		Item_WPN_GTY_Shortsword_A
MAG_Viconia_Mace	Handmaiden's Mace	This mace was designed by Lolth's assassins to fell heretics who dared turn their back on the Spider Queen. However, even the best-laid designs fall to nothingness when brought to bear against Shar's faithful.	Булава служанки	Эта булава была создана ассасинами Ллос для уничтожения еретиков, посмевших отвернуться от Паучьей королевы. Впрочем, и самые продуманные планы рушатся, если им противостоят верные служители Шар.	
MAG_Viconia_Robe	Viconia's Priestess Robe	Listening to the magical hum this robe emits dulls your senses, thoughts, feelings - everything. Listen too long, and you can almost hear the screaming chitters of a thousand spiders devoured by encroaching, hungry darkness. Almost. 	Одеяние Виконии	Издаваемый этой одеждой волшебный гул притупляет и чувства, и мысли. Если слушать его слишком долго, можно почти услышать верещание тысяч пауков, которых пожирает голодная тьма. Почти. 	
MAG_Violence_LowHP_Violence_Clothes	Bloodguzzler Garb	No sooner does blood speck the armour than it's absorbed, as if sustaining something within.	Одежда кровопийцы	Капли крови, попавшие на этот доспех, мгновенно впитываются в его поверхность, словно бы насыщая нечто таящееся внутри.	Item_MAG_Violence_LowHP_Violence_Clothes
MAG_Violence_ViolenceOnDamaged_Helmet	Cap of Wrath	With every blow the skullcap seems to compress, narrowing the vision of the wearer.	Шлем гнева	Такое ощущение, что с каждым ударом этот шлем сжимается, словно шоры, сужая поле зрения владельца.	Item_MAG_Violence_ViolenceOnDamaged_Helmet
MAG_Violence_ViolenceOnDash_Boots	Linebreaker Boots	Lightweight fur and leather, designed to speed the wearer's charge into battle.	Таранные сапоги	Легкие сапоги из меха и кожи, сшитые для тех, кому не терпится ринуться на врага.	Item_MAG_Violence_ViolenceOnDash_Boots
MAG_WATCHER_Human_Crossbow	Hellfire Engine Crossbow	'Trundling, mashing, mincing, crushing, grinding, blasting, biting! Hear their peeling thunder, their roaring flames, their clicking, whirring, metallic melody, and know that the hellfire engines of Avernus are on the move!' - Edict in Elturel 	Адский самовзводный арбалет	«Скручивание, размалывание, измельчение, дробление, растирание, взрыв, кусание! Услышьте их рокот, рев пламени, их щелчки и жужжание, металлическую мелодию, и знайте, что машины адского огня Аверно уже в пути!» – Эдикт в Элтуриэле 	Item_WPN_WATCHER_Crossbow
MAG_WATCHER_Human_Greataxe	Hellfire Greataxe	Anything hit by this has the life expectancy of a glass hammer.	Двуручный топор адского пламени	Все, по чему попадет этот топор, можно сразу и безоговорочно списывать в утиль.	
MAG_WYRM_Commander_Longsword	Duke Ravengard's Longsword	Cradling his newborn son awkwardly, the Duke's face pulled into a rictus of misery. His love Francesca smiled at him, briefly, and died. He stared at her until the boy cried, and he told the boy it would be all right, though he himself did not believe it.	Длинный меч герцога Рейвенгарда	Неловко прижимая к себе новорожденного сына, герцог смотрит на мир с тоской. Его возлюбленная Франческа улыбнулась ему на прощанье и скончалась. Он не сводил с нее глаз, пока младенец не заплакал. Он сказал мальчику, что всё будет хорошо, хотя сам в это не верил.	
MAG_WYRM_Farlin_Dagger	Gleamdance Dagger	A pair of pixie wings were used to create this pretty blade - their delicate tracings can be seen all day and night, though they shine brightest by the light of a gibbous moon.	Кинжал мерцающего танца	При создании этого изящного клинка использовались крылышки пикси. Их тонкие очертания можно разглядеть и днем, и ночью, но виднее всего они при свете растущей луны. 	
MAG_WYRM_OfBalduran_Helmet	Helm of Balduran	This helm, worn atop the pate of Balduran the Brave, still gleams as if with the untarnished splendour of his legacy. Baldur's Gate itself bears his name, and tales of his exploits have turned the heads and hearts of many. 	Шлем Балдурана	Этот шлем носил сам Балдуран Храбрый, и он до сих пор сияет незапятнанным величием его наследия. Врата Балдура были названы в честь этого героя, и рассказы о его подвигах вскружили головы многих. 	Generated_MAG_WYRM_OfBalduran_Helmet_Magic
MAG_WYRM_OfTruthTelling_Ring	Ring of Truthfulness	'Fib now, and forever hold your teeth.' - Folk saying	Кольцо правдивости	«Соврешь сейчас – потом всю жизнь держать язык за зубами», – народная поговорка.	
MAG_WYRM_SleepImmunity_Amulet	Wakeful Amulet	While this doesn't prevent wilful rest, it does protect you from being put to sleep from such sources as hypnotism, copious alcohol usage, or, indeed, magic. 	Бессонный амулет	Этот амулет не помешает заснуть, если ты это делаешь по своей воле, но защитит от сна, вызванного гипнозом, чрезмерным употреблением спиртного или магией. 	
MAG_WYRM_UndeadBane_GreatAxe	The Undead Bane	Wielded by the indomitable Ser Lexia. Although her eagerness to destroy evil in all its forms was constant, she often took time to make little gifts for her friends.	Гроза нежити	Оружие неукротимой дамы Лексии. Она была готова уничтожать зло во всех его проявлениях, но всегда находила время делать друзьям маленькие подарки.	
MAG_WYRM_UndeadProtector_Robe	Veil of the Morning	Crafted from celestial feathers, bottled sunlight, and ink from the pages of sacred scripture, it's a wonder the maker didn't hang cloves of garlic from this robe, so anathema is it to the undead.	Утренний покров	Эта мантия соткана из перьев небожителя, рога единорога, речной воды, солнечного света в бутылках и чернил со страниц священных книг. Даже удивительно, что создатель обошелся без зубчиков чеснока... Для нежити эта мантия нестерпима.	Generated_MAG_WYRM_UndeadProtector_Robe_Magic
MAG_WYR_Hellrider_Longbow	Hellrider Longbow	This longbow was forged from the remnants of Stanislav the Silver's shield, found near the wreckage of Castle Ravenloft some years ago. 	Длинный лук адского всадника	Этот длинный лук выкован из обломков щита Станислава Серебряного, найденных близ развалин замка Рейвенлофт несколько лет назад. 	
MAG_WYR_Orin_Bhaalist_Dagger	Blade of the First Blood	The Lord of Murder wasn't always a lord. He was once just a petty killer. When Bhaal first drew blood in a Baldurian back-alley, it dropped to the ground and lingered. When he ascended, this dried blood-drop grew, warped - and became sharp. 	Кинжал первой крови	Владыка Убийств не всегда был владыкой. Когда-то он убивал за гроши. В час, когда Баал впервые пролил кровь в переулке где-то во Вратах Балдура, та стекла на землю... и осталась на ней. Когда Баал вознесся, засохшая кровь стала расти и искривляться, пока не превратилась в острое лезвие. 	Item_WPN_HUM_Dagger_Orin_A
MAG_Warlock_Quickened_Gloves	Quickspell Gloves	These gloves were worn by the wizard Bucknard, who always maintained that speed was most important in spellcasting. This, because even if you royally bugger up the spell, you've got enough time to leg it away afterward. 	Перчатки быстрых чар	Эти перчатки когда-то носил волшебник Бакнард, утверждавший, что для заклинателя скорость очень важна. Потому что даже если ты капитально налажаешь с чарами, то всегда успеешь отбежать достаточно далеко. 	
MAG_Warlock_Twinned_Gloves	Gemini Gloves	Designed by an arcane smith with half-vision. He made these gloves to make sure his spells hit their target. 	Перчатки-близнецы	Творение кузнеца-мага, у которого в глазах половинилось. Глаза его были в полном порядке, и страдал он не от раздвоения, а наоборот – видел лишь половину всего. Он создал эти перчатки, чтобы его заклинания всегда попадали в цель. 	Generated_MAG_Warlock_Twinned_Gloves_Magic
MAG_Wizard_Pointy_Hat	The Pointy Hat	Sages over the course of ages have dealt very constructive and useful advice - however, none so sagacious as that of the wizard Otiluke, who once advised one of his students thusly: 'Never cast Speak with Dead on a loved one if there's unresolved tension there. It's never worth it. Trust me.'	Остроконечная шляпа	Мудрецы на протяжении многих веков давали весьма конструктивные и полезные советы, но ни один из них не сравнится мудростью с волшебником Отилюком. Тот однажды посоветовал одному из своих учеников следующее: «Никогда не применяй „Разговор с мертвым" к близкому человеку, особенно если при жизни вы не очень ладили. Не стоит оно того, поверь».	Item_ARM_Hat_Wizard_H
MAG_WoodWoad_Nature_Shield	Wood Woad Shield	'And with her arm the dryad linked a man who had once been her lover, and once of flesh and bone. Now his flesh was bark, and his bone heartwood. In his eyes a feverish love still blazed like a thousand fireflies in a spring meadow.'	Щит из дерева вайды	«Рукой своей дриада обвила мужчину, бывшего прежде ее возлюбленным из плоти и крови. Тут же плоть его стала корой, а кости – древесиной, насыщенной старыми соками, хотя взор его горел любовной лихорадкой, подобно тысячам светлячков на весеннем лугу».	
MAG_ZOC_AdvantageOnMeleeAttackWhileSurounded_Gloves	Gloves of the Growling Underdog	Crowded taprooms. Packed feast halls. Bustling market bazaars. Chances to be social? Sure. Chances to be violent? Absolutely. 	Перчатки рычащего пса	Шумные кабаки. Битком набитые таверны. Шумные рынки. Возможностей пообщаться? Уйма. Возможностей подраться? До хрена и больше. 	Item_ARM_Gloves_Metal_E
MAG_ZOC_ForceConduitWhileSurounded_Boots	Tenacious Boots	Plant your feet firm as an oak, your roots determinate, your balance as precise as the contour of the moon. 	Цепкие сапоги	Упрись ногами прочно, подобно дубу, корни полны решимости, равновесие – четкое, как контур луны. 	Item_ARM_Boots_Metal_B_Magic
MAG_ZOC_ForceConduit_ChainMail	Rippling Force Mail	Dents, notches, and nicks add character to each ring of this mail - yet each blemish also speaks to those who tasted magical vengeance on the armour's behalf.	Кольчуга сминающей силы	Вмятины, зазубрины и царапины придают своеобразия каждому колечку этой кольчуги... и магическую месть этого доспеха хорошо помнят все, кто нанес ей повреждения. 	Generated_MAG_ZOC_ForceConduit_ChainMail_Magic
MAG_ZOC_ForceConduit_Halberd	The Skinburster	In mellow light, the halberd's curved steel head eerily resembles a grin. 	Пронзатель кожи	В мягком свете изогнутое лезвие этой алебарды пугающе напоминает усмешку. 	
MAG_ZOC_Force_Helmet	Tightening Orbit Helm	'Keep your enemies close, and those you want to slit up closer.' - Popular nursery saying	Шлем сжимающегося кольца	«Держи своих врагов близко, а тех, кого хочешь прирезать, еще ближе», – популярная инкубаторская присказка.	Item_ARM_Helmet_Metal_B_Magic
MAG_ZOC_RampartAura_Amulet	Treacleflow Amulet	The air surrounding this lavishly decorated amulet is thick - like pushing your fingers through sap or syrup.	Амулет текучей патоки	Воздух вокруг этого богато выделанного амулета кажется таким густым, как будто твои пальцы увязают в смоле или сиропе.	
MAG_Zhentarim_BloodfeederBlade_Rapier	Sanguine Blade	Blood enthrals and holds great dominion over people. Its wine-dark stain anoints even the pacifist in such troubled times as these. 	Кровожадный клинок	Кровь берет и удерживает власть над людьми. В такие смутные времена, как сейчас, ее винно-красное пятно можно заметить даже на пацифисте. 	
MAG_Zhentarim_Lockpicking_Gloves	Knock Knuckle Gloves	In the palm of the left glove is a glossy scarlet solution that coats Thieves' Tools, making them more reliable. In the right, arcane symbols wax and wane. 	Перчатки настойчивого стука	Ладонь левой перчатки скрывает глянцевый алый раствор, которым смазывают воровские инструменты для надежности. На правой проступают и исчезают таинственные символы. 	
MAG_Zhentarim_SleeperDagger	Dread Iron Dagger	A web of veins runs the length of the blade - it has become a slender iron mortuary for all the innocents it has tasted. 	Кинжал железного страха	Паутина вен расходится по всей длине лезвия – оно стало своего рода тонкой железной могилой для всех невинных жертв, которых отведало. 	
MAG_Zhentarim_Swap_Gloves	Dark Displacement Gloves	Rudimentary teleportation sigils mark the palms of these gloves, like coiled snakes in a bath of pitch.	Перчатки темного ускользания	Примитивные символы телепортации красуются на ладонях этих перчаток, от них до самых костяшек пальцев расползаются стежки, подобно змеям в смоле. 	
MAG_ofGreaterHealth_Amulet	Amulet of Greater Health	Worn by Lumi, a cleric beholden to twilight, who sheltered her fellow adventurers as a bantam shelters her chicks. 	Амулет великого здоровья	Принадлежал Луми, жрице сумерек, которая укрывала своих товарищей по приключениям, как курица укрывает своих цыплят. 	Item_MAG_ofGreaterHealth_Amulet
MAG_ofMarksmanship_Hat	Marksmanship Hat		Шляпа меткого стрелка		
